{
  "title": "Veloci-Tea",
  "logline": "A genetically engineered Velociraptor escapes a shady biotech lab and hides in a failing Portland tea shop, where her refined nose for perfect blends gives a sarcastic widow one last reason to keep brewing.",
  "aspect_ratio": "16:9",
  "fps": 24,
  "tone": "Heartwarming, odd-couple, whimsical indie comedy; Amelie meets Paddington, never scary.",
  "era": "Contemporary rainy Portland with cozy artisanal tea culture and lightly absurd biotech noir.",
  "characters": [
    {
      "id": "mara_bell",
      "name": "Mara Bell",
      "description": "Sarcastic, burnt-out widow in her early 40s who owns the failing artisanal Portland tea shop Steep Endings; grieving, dry-witted, guarded but kind.",
      "wardrobe": "Rumpled natural-linen apron over dark practical layers, worn boots, loose sleeves, tea towel always nearby.",
      "profile": {
        "physical_signature": "Early 40s, tired posture softening over the pilot, expressive skeptical eyebrow, ink-stained hands from menu chalk.",
        "face": "Warm but exhausted face with fine smile lines and guarded eyes.",
        "hair": "Messy dark-brown bob usually tucked behind one ear.",
        "eyes": "Hazel, dryly observant, gradually warmer.",
        "body": "Average height, slightly hunched from stress, relaxed by the finale.",
        "movement": "Efficient, clipped motions that become gentler around Oolong.",
        "personality": "Sarcastic, grieving, practical, secretly tender, protective.",
        "voice": "Dry, low, wry Portland deadpan.",
        "consistency_notes": "Keep her visually grounded and human; her arc is from isolation to cautious delight.",
        "negative_prompt": "No glam makeover, no cruelty, no action-hero styling."
      }
    },
    {
      "id": "oolong",
      "name": "Oolong",
      "description": "A 7-foot-tall genetically engineered feathered Velociraptor whose refined sense of smell makes her a Michelin-level tea sommelier; gentle, bashful, expressive, and non-scary.",
      "wardrobe": "No clothing except occasional accidental tea sack scarf or dusting of matcha; never armored or monstrous.",
      "profile": {
        "physical_signature": "Tall feathered Velociraptor with iridescent moss-green and chestnut plumage, large curious amber eyes, nimble claws, long balancing tail, friendly posture.",
        "face": "Expressive reptilian face softened by feathers and wide amber eyes, capable of bashful comedy.",
        "hair": "Feather crest rather than hair, slightly ruffled when nervous.",
        "eyes": "Large amber eyes, intelligent, gentle, apologetic.",
        "body": "Seven feet tall, athletic but careful, feathered, never horror-coded.",
        "movement": "Precise claw gestures, delicate tiptoeing, silent-film comedic timing, tea-sommelier focus when sniffing.",
        "personality": "Curious, gentle, tea-obsessed, shy, loyal, proud of perfect blends.",
        "voice": "Soft chirps, purrs, and tiny pleased trills; no roars.",
        "consistency_notes": "Always heartwarming and non-threatening; show tea genius through smell, steam, color, and exact claw pinches.",
        "negative_prompt": "No blood, no snarling predator shots, no horror lighting, no attacking customers."
      }
    },
    {
      "id": "devon_pike",
      "name": "Devon Pike",
      "description": "A nervous biotech handler trying to retrieve Oolong without causing a scene; fussy, corporate, and increasingly undone by tea-shop etiquette.",
      "wardrobe": "Too-clean gray windbreaker, laminated badge, rain-damp trousers, sensible shoes, clipboard or missing-asset flyer.",
      "profile": {
        "physical_signature": "Nervous posture, tidy hair flattened by rain, corporate badge always slightly crooked.",
        "movement": "Fussy small steps, clipboard clutching, awkward peering through windows.",
        "personality": "Rule-bound, anxious, polite, baffled by warmth.",
        "voice": "Careful corporate politeness cracking into confusion.",
        "consistency_notes": "Antagonistic pressure without menace; more bureaucratic nuisance than villain."
      }
    },
    {
      "id": "june_alvarez",
      "name": "June Alvarez",
      "description": "A loyal neighborhood regular in her 60s with bright glasses, blunt warmth, and a love of gossip; first customer astonished by Oolong's blend.",
      "wardrobe": "Colorful raincoat, bright glasses, patterned scarf, practical Portland shoes.",
      "profile": {
        "physical_signature": "Bright glasses, warm lined face, expressive hands wrapped around mugs.",
        "movement": "Direct, cheerful, nosy, comfortable in the shop.",
        "personality": "Blunt, warm, gossip-loving, generous.",
        "voice": "Lively neighborhood candor.",
        "consistency_notes": "Her delighted reaction sells the secret blend to the neighborhood."
      }
    }
  ],
  "locations": [
    {
      "id": "steep_endings",
      "name": "Steep Endings Tea Shop",
      "description": "A failing cozy artisanal tea shop in rainy Portland with mismatched chairs, hand-lettered chalkboard menus, shelves of tea tins, hanging plants, foggy windows, and a cramped back room full of sacks, kettles, scales, and shipping boxes."
    },
    {
      "id": "biotech_alley",
      "name": "Biotech Alley",
      "description": "A damp service alley behind a shady biotech lab, blue security lights, steam vents, loading doors, wet pavement, and absurdly polite warning signs."
    },
    {
      "id": "portland_sidewalk",
      "name": "Portland Sidewalk",
      "description": "Rain-slick sidewalk outside Steep Endings with bicycles, umbrellas, food-cart lights, indie posters, passing curious neighbors, and warm shop light spilling onto puddles."
    }
  ],
  "visual_rules": {
    "do": [
      "Keep Oolong gentle, bashful, expressive, and comedic rather than frightening.",
      "Use cozy warm practical tea-shop light against cool Portland rain.",
      "Show tea blending through visible steam, scent swirls, precise claw gestures, and tactile ingredients.",
      "Maintain whimsical indie comedy framing with soft storybook charm."
    ],
    "dont": [
      "Do not make Oolong scary, bloody, roaring, or predatory.",
      "Do not stage action violence or horror suspense.",
      "Do not contradict character locks in shot prompts.",
      "Do not make the shop sleek or successful before the neighborhood discovers the blends."
    ],
    "color_palette": ["warm amber", "soft teal", "rainy slate blue", "moss green", "chestnut", "matcha green", "lavender haze"]
  },
  "reference_notes": "5-minute pilot movie, 300 seconds total, planned as 30 shots at 10 seconds each. Whimsical indie comedy with heartwarming odd-couple energy."
}
